{
  "schema_version": "1.0",
  "story_key": "E99-S103",
  "skill": "gaia-security-review",
  "model": "claude-opus-4-7",
  "model_temperature": 0,
  "tool_versions": {
    "semgrep": "1.65.0",
    "gitleaks": "8.18.0",
    "npm-audit": "10.5.0"
  },
  "file_hashes": {
    "src/example.ts": "abc111"
  },
  "checks": [
    {
      "name": "semgrep",
      "scope": "file",
      "status": "passed",
      "findings": [
        {
          "file": "src/example.ts",
          "line": 12,
          "severity": "warning",
          "rule": "javascript.lang.security.audit.unsafe-string-concat",
          "rule_confidence": "low",
          "rule_severity": "warning",
          "message": "String concatenation in SQL-like context — confidence low (heuristic match)",
          "blocking": false
        }
      ]
    },
    {
      "name": "gitleaks",
      "scope": "file",
      "status": "passed",
      "findings": []
    },
    {
      "name": "npm-audit",
      "scope": "project",
      "status": "passed",
      "findings": []
    }
  ]
}
