{
  "schema_version": "1.0",
  "story_key": "E99-S3",
  "skill": "gaia-code-review",
  "model": "claude-opus-4-7",
  "model_temperature": 0,
  "tool_versions": {
    "ruff": "0.5.0",
    "tsc": "5.4.0"
  },
  "file_hashes": {
    "src/handler.py": "789abc"
  },
  "checks": [
    {
      "name": "ruff",
      "scope": "file",
      "status": "passed",
      "findings": []
    },
    {
      "name": "tsc",
      "scope": "project",
      "status": "skipped",
      "skip_reason": "no TypeScript files in File List"
    }
  ]
}
