{
  "schema_version": "1.0",
  "story_key": "E99-S2",
  "skill": "gaia-code-review",
  "model": "claude-opus-4-7",
  "model_temperature": 0,
  "tool_versions": {
    "eslint": "9.0.0"
  },
  "file_hashes": {
    "src/lint-target.ts": "def456"
  },
  "checks": [
    {
      "name": "eslint",
      "scope": "file",
      "status": "errored",
      "error_reason": "ESLint config crash: Cannot read property 'parserOptions' of undefined (malformed .eslintrc)."
    }
  ]
}
